{
  "schemaVersion": "1.0.0",
  "authoringVersion": "change-calibration-authoring/0.1.0",
  "status": "unreviewed",
  "warning": "UNREVIEWED CHANGE EHE: candidate values are reference material, not calibration labels. Review the normalized final delta without using history activity as effort evidence.",
  "rubric": {
    "id": "change-ehe-work-item",
    "version": "1.0.0"
  },
  "repository": {
    "id": "repository:change-js-lib-b",
    "name": "repository:change-js-lib-b",
    "sourceDigest": "sha256:61b64b1b2fcad567ad335f196bff92b11f97e125495f8fcb0e97faf247c2a7b6"
  },
  "change": {
    "id": "change:js-lib-quality",
    "selectionKind": "base-head",
    "baseObjectId": "a7fea269f6561da9c338eb33b5da16e6f22ca04a7f8cb0750114ec1633628c57",
    "headObjectId": "baee61630f16c6ac6aac83c4a2526a7bd12b95973bd549aa3fdfda291e6a87d8",
    "baseEvidenceDigest": "sha256:56a65652f5a7e6eacd3f45c86c8fb82f10c1404558b8aaf82ed41b20be32f075",
    "headEvidenceDigest": "sha256:c8c7f7148da42ac3b8687a226f2dbf9ee73eb3da1191ffefb481c0cc0a9ec781",
    "finalDeltaDigest": "sha256:61b64b1b2fcad567ad335f196bff92b11f97e125495f8fcb0e97faf247c2a7b6",
    "coverageTags": [
      "documentation",
      "javascript",
      "tests"
    ]
  },
  "profile": "implementation",
  "baselineId": "senior-contractor-2026-no-ai",
  "candidateVisibility": "blind",
  "candidate": {
    "estimatorVersion": "change-seed/0.1.0\u002Bseed-rules/0.2.1",
    "estimateDigest": "sha256:b3d9dc9cd4d1e7868308476f64c73d623dd13f533a0118eb34994dad2f94fd12",
    "totalHours": null,
    "categories": []
  },
  "targets": [
    {
      "id": "target:change-item:capability-marginal:642ee2bf883c7e867a23",
      "sourceCapabilityId": "change-item:capability-marginal:642ee2bf883c7e867a23",
      "category": "unit-testing",
      "title": "Add Create represented unit tests for \u0027.\u0027 (package)",
      "scope": ".",
      "sourceWorkItemIds": [
        "change-item:capability-marginal:642ee2bf883c7e867a23"
      ],
      "evidenceIds": [
        "change:path:cc0103195f5135e28c870a1e"
      ],
      "candidate": {
        "hours": null,
        "confidence": null,
        "reason": "Positive base-to-head marginal effort from the existing repository capability model, bounded by touched final-change regions when existing behavior was also modified."
      },
      "review": {
        "hours": null,
        "rationale": null,
        "sizeException": null
      },
      "assumptions": [
        "The final base-to-head artifact delta is valued once with modern 2026-equivalent technology.",
        "Commit count, elapsed time, authorship, messages, and intermediate churn are not effort multipliers."
      ],
      "exclusions": [
        "Historical rework and discarded intermediate states are excluded."
      ],
      "uncertaintyReasons": [
        "Some supporting evidence is inferred rather than directly observed."
      ]
    },
    {
      "id": "target:change-item:capability-marginal:8d9eeb16554812f09577",
      "sourceCapabilityId": "change-item:capability-marginal:8d9eeb16554812f09577",
      "category": "documentation",
      "title": "Add Author and verify maintained repository documentation",
      "scope": ".",
      "sourceWorkItemIds": [
        "change-item:capability-marginal:8d9eeb16554812f09577"
      ],
      "evidenceIds": [
        "change:path:c8ffaa9bc9501ddceca239a8"
      ],
      "candidate": {
        "hours": null,
        "confidence": null,
        "reason": "Positive base-to-head marginal effort from the existing repository capability model, bounded by touched final-change regions when existing behavior was also modified."
      },
      "review": {
        "hours": null,
        "rationale": null,
        "sizeException": null
      },
      "assumptions": [
        "The final base-to-head artifact delta is valued once with modern 2026-equivalent technology.",
        "Commit count, elapsed time, authorship, messages, and intermediate churn are not effort multipliers."
      ],
      "exclusions": [
        "Historical rework and discarded intermediate states are excluded."
      ],
      "uncertaintyReasons": []
    },
    {
      "id": "target:change-item:capability-modification:df7b5afaec3fb445df60",
      "sourceCapabilityId": "change-item:capability-modification:df7b5afaec3fb445df60",
      "category": "production-implementation",
      "title": "Modify Implement maintained internal logic for \u0027.\u0027 (package)",
      "scope": ".",
      "sourceWorkItemIds": [
        "change-item:capability-modification:df7b5afaec3fb445df60"
      ],
      "evidenceIds": [
        "change:path:cc0103195f5135e28c870a1e"
      ],
      "candidate": {
        "hours": null,
        "confidence": null,
        "reason": "The final artifact changed inside an existing evidence-backed capability even though its repository-level structural quantity did not increase."
      },
      "review": {
        "hours": null,
        "rationale": null,
        "sizeException": null
      },
      "assumptions": [
        "The final base-to-head artifact delta is valued once with modern 2026-equivalent technology.",
        "Commit count, elapsed time, authorship, messages, and intermediate churn are not effort multipliers."
      ],
      "exclusions": [
        "Historical rework and discarded intermediate states are excluded."
      ],
      "uncertaintyReasons": [
        "Aggregate source structure was proportionally adjusted using production/test file classification."
      ]
    },
    {
      "id": "target:change-item:change-comprehension:0e8e9f9cbe2e447a42db",
      "sourceCapabilityId": "change-item:change-comprehension:0e8e9f9cbe2e447a42db",
      "category": "specification-comprehension-and-domain-learning",
      "title": "Understand the bounded change specification",
      "scope": ".",
      "sourceWorkItemIds": [
        "change-item:change-comprehension:0e8e9f9cbe2e447a42db"
      ],
      "evidenceIds": [
        "change:path:c8ffaa9bc9501ddceca239a8",
        "change:path:cc0103195f5135e28c870a1e"
      ],
      "candidate": {
        "hours": null,
        "confidence": null,
        "reason": "Comprehend the final behavior and quality delta represented by the affected capability categories."
      },
      "review": {
        "hours": null,
        "rationale": null,
        "sizeException": null
      },
      "assumptions": [
        "The final base-to-head artifact delta is valued once with modern 2026-equivalent technology.",
        "Commit count, elapsed time, authorship, messages, and intermediate churn are not effort multipliers."
      ],
      "exclusions": [
        "Historical rework and discarded intermediate states are excluded."
      ],
      "uncertaintyReasons": []
    },
    {
      "id": "target:change-item:change-review:61963b074c40be2353b4",
      "sourceCapabilityId": "change-item:change-review:61963b074c40be2353b4",
      "category": "self-review-and-system-integration",
      "title": "Review and integrate the completed change",
      "scope": ".",
      "sourceWorkItemIds": [
        "change-item:change-review:61963b074c40be2353b4"
      ],
      "evidenceIds": [
        "change:path:c8ffaa9bc9501ddceca239a8",
        "change:path:cc0103195f5135e28c870a1e"
      ],
      "candidate": {
        "hours": null,
        "confidence": null,
        "reason": "Review the coherent final delta and integrate its affected maintained artifacts; this is derived from final scope rather than commit count."
      },
      "review": {
        "hours": null,
        "rationale": null,
        "sizeException": null
      },
      "assumptions": [
        "The final base-to-head artifact delta is valued once with modern 2026-equivalent technology.",
        "Commit count, elapsed time, authorship, messages, and intermediate churn are not effort multipliers."
      ],
      "exclusions": [
        "Historical rework and discarded intermediate states are excluded."
      ],
      "uncertaintyReasons": []
    }
  ],
  "professionalizationGapWorkItemIds": [],
  "instructions": [
    "Confirm repository-family identity, immutable base/head provenance, license, redistribution, and partition before compilation.",
    "Estimate only the normalized final functional and quality delta; intermediate churn, commit count, author, and elapsed time are forbidden signals.",
    "Use the source Change report and explain query to verify evidence, exclusions, and final-delta reconciliation without using candidate hours when blind.",
    "Fill review hours and rationale independently for every represented target; use an exact 0/0/0 range plus a size exception for a reviewed false positive, while an empty target list is valid only for a zero-EHE final delta.",
    "Keep expected targets near 0.5 to 8 hours, record uncertainty explicitly, and reconcile the final total only after target review.",
    "Compile teacher labels before a distinct reviewer receives a blind second-pass packet; packet generation alone does not advance maturity."
  ]
}
