{
  "schemaVersion": "1.0.0",
  "authoringVersion": "change-calibration-authoring/0.1.0",
  "status": "unreviewed",
  "warning": "UNREVIEWED CHANGE EHE: candidate values are reference material, not calibration labels. Review the normalized final delta without using history activity as effort evidence.",
  "rubric": {
    "id": "change-ehe-work-item",
    "version": "1.0.0"
  },
  "repository": {
    "id": "repository:change-mixed-app-a",
    "name": "repository:change-mixed-app-a",
    "sourceDigest": "sha256:cbf9041cf567c7d879d939b7ea6a175e35d00a665f5860cc08155664e3b0341d"
  },
  "change": {
    "id": "change:mixed-overlap-range",
    "selectionKind": "range",
    "baseObjectId": "ca1b2033595e90f099e346a6244d153d1f75c8ec7aca505619561a66cc420454",
    "headObjectId": "fd8ce75783eba2a56d1da9270ae35a26fa8bcf73e1ac364813d645724574a972",
    "baseEvidenceDigest": "sha256:cf04fe80e4007f1f54818e3a4c73d305695f16ac44fe6ed884ef28e04458355a",
    "headEvidenceDigest": "sha256:9cb82215488dbef8fa4b0a3024eb2a41e08a3c471c020c2e17e930b9e745b56f",
    "finalDeltaDigest": "sha256:cbf9041cf567c7d879d939b7ea6a175e35d00a665f5860cc08155664e3b0341d",
    "coverageTags": [
      "mixed",
      "overlap",
      "range",
      "reconciliation"
    ]
  },
  "profile": "implementation",
  "baselineId": "senior-contractor-2026-no-ai",
  "candidateVisibility": "blind",
  "candidate": {
    "estimatorVersion": "change-seed/0.1.0\u002Bseed-rules/0.2.1",
    "estimateDigest": "sha256:5db6a1db1bf272c89c9ab4355417b926bdc1eaf5b1b9ff164bb158f2ea6738bb",
    "totalHours": null,
    "categories": []
  },
  "targets": [
    {
      "id": "target:change-item:capability-marginal:1df06ce623534ba0a6df",
      "sourceCapabilityId": "change-item:capability-marginal:1df06ce623534ba0a6df",
      "category": "production-implementation",
      "title": "Expand Implement maintained internal logic for \u0027.\u0027 (package)",
      "scope": ".",
      "sourceWorkItemIds": [
        "change-item:capability-marginal:1df06ce623534ba0a6df"
      ],
      "evidenceIds": [
        "change:path:dbdd4210a9171ae543df08a4"
      ],
      "candidate": {
        "hours": null,
        "confidence": null,
        "reason": "Positive base-to-head marginal effort from the existing repository capability model, bounded by touched final-change regions when existing behavior was also modified."
      },
      "review": {
        "hours": null,
        "rationale": null,
        "sizeException": null
      },
      "assumptions": [
        "The final base-to-head artifact delta is valued once with modern 2026-equivalent technology.",
        "Commit count, elapsed time, authorship, messages, and intermediate churn are not effort multipliers."
      ],
      "exclusions": [
        "Historical rework and discarded intermediate states are excluded."
      ],
      "uncertaintyReasons": [
        "Some TypeScript or fallback structure is token-backed rather than parser-backed."
      ]
    },
    {
      "id": "target:change-item:change-comprehension:9783732704ae1ef40446",
      "sourceCapabilityId": "change-item:change-comprehension:9783732704ae1ef40446",
      "category": "specification-comprehension-and-domain-learning",
      "title": "Understand the bounded change specification",
      "scope": ".",
      "sourceWorkItemIds": [
        "change-item:change-comprehension:9783732704ae1ef40446"
      ],
      "evidenceIds": [
        "change:path:dbdd4210a9171ae543df08a4"
      ],
      "candidate": {
        "hours": null,
        "confidence": null,
        "reason": "Comprehend the final behavior and quality delta represented by the affected capability categories."
      },
      "review": {
        "hours": null,
        "rationale": null,
        "sizeException": null
      },
      "assumptions": [
        "The final base-to-head artifact delta is valued once with modern 2026-equivalent technology.",
        "Commit count, elapsed time, authorship, messages, and intermediate churn are not effort multipliers."
      ],
      "exclusions": [
        "Historical rework and discarded intermediate states are excluded."
      ],
      "uncertaintyReasons": []
    },
    {
      "id": "target:change-item:change-review:06d95c06c1e299f2d1b2",
      "sourceCapabilityId": "change-item:change-review:06d95c06c1e299f2d1b2",
      "category": "self-review-and-system-integration",
      "title": "Review and integrate the completed change",
      "scope": ".",
      "sourceWorkItemIds": [
        "change-item:change-review:06d95c06c1e299f2d1b2"
      ],
      "evidenceIds": [
        "change:path:dbdd4210a9171ae543df08a4"
      ],
      "candidate": {
        "hours": null,
        "confidence": null,
        "reason": "Review the coherent final delta and integrate its affected maintained artifacts; this is derived from final scope rather than commit count."
      },
      "review": {
        "hours": null,
        "rationale": null,
        "sizeException": null
      },
      "assumptions": [
        "The final base-to-head artifact delta is valued once with modern 2026-equivalent technology.",
        "Commit count, elapsed time, authorship, messages, and intermediate churn are not effort multipliers."
      ],
      "exclusions": [
        "Historical rework and discarded intermediate states are excluded."
      ],
      "uncertaintyReasons": []
    }
  ],
  "professionalizationGapWorkItemIds": [],
  "instructions": [
    "Confirm repository-family identity, immutable base/head provenance, license, redistribution, and partition before compilation.",
    "Estimate only the normalized final functional and quality delta; intermediate churn, commit count, author, and elapsed time are forbidden signals.",
    "Use the source Change report and explain query to verify evidence, exclusions, and final-delta reconciliation without using candidate hours when blind.",
    "Fill review hours and rationale independently for every represented target; use an exact 0/0/0 range plus a size exception for a reviewed false positive, while an empty target list is valid only for a zero-EHE final delta.",
    "Keep expected targets near 0.5 to 8 hours, record uncertainty explicitly, and reconcile the final total only after target review.",
    "Compile teacher labels before a distinct reviewer receives a blind second-pass packet; packet generation alone does not advance maturity."
  ]
}
