{
  "schemaVersion": "1.0.0",
  "authoringVersion": "change-calibration-authoring/0.1.0",
  "status": "unreviewed",
  "warning": "UNREVIEWED CHANGE EHE: candidate values are reference material, not calibration labels. Review the normalized final delta without using history activity as effort evidence.",
  "rubric": {
    "id": "change-ehe-work-item",
    "version": "1.0.0"
  },
  "repository": {
    "id": "repository:change-dn-lib-a",
    "name": "repository:change-dn-lib-a",
    "sourceDigest": "sha256:b248b960913b00536f39397ae8081b16ad1f9ee01adf701b2c8bdaf280631514"
  },
  "change": {
    "id": "change:dn-lib-production",
    "selectionKind": "base-head",
    "baseObjectId": "020c1a6afd52700f68fa76d12c82dd45e66d0428d400fb6729a877bf74495976",
    "headObjectId": "716343eb8f3f969f9764a9dc548b6f59b794e3066d33cc58fc96cbcc77aa99f6",
    "baseEvidenceDigest": "sha256:1f257cb29f21608b94c804bf3bac4c4dc673809c90c71be6d20843e94c873737",
    "headEvidenceDigest": "sha256:2604d06417c02eaa0e16132e831f11211bb9f3c03ca1e6f7159b8d3589fb7174",
    "finalDeltaDigest": "sha256:b248b960913b00536f39397ae8081b16ad1f9ee01adf701b2c8bdaf280631514",
    "coverageTags": [
      "clean-disjoint",
      "dotnet",
      "production"
    ]
  },
  "profile": "implementation",
  "baselineId": "senior-contractor-2026-no-ai",
  "candidateVisibility": "blind",
  "candidate": {
    "estimatorVersion": "change-seed/0.1.0\u002Bseed-rules/0.2.1",
    "estimateDigest": "sha256:74ddd2272887b9f6bc0444233f26f33f75127cf0ac3827e1c61ca4d63f2b02db",
    "totalHours": null,
    "categories": []
  },
  "targets": [
    {
      "id": "target:change-item:capability-marginal:e76424ac4c86f9a7a366",
      "sourceCapabilityId": "change-item:capability-marginal:e76424ac4c86f9a7a366",
      "category": "production-implementation",
      "title": "Add Implement maintained internal logic for \u0027src/Slug/Slug.csproj\u0027 (library)",
      "scope": "src/Slug/Slug.csproj",
      "sourceWorkItemIds": [
        "change-item:capability-marginal:e76424ac4c86f9a7a366"
      ],
      "evidenceIds": [
        "change:path:aaaaec349d37340efffbdf86"
      ],
      "candidate": {
        "hours": null,
        "confidence": null,
        "reason": "Positive base-to-head marginal effort from the existing repository capability model, bounded by touched final-change regions when existing behavior was also modified."
      },
      "review": {
        "hours": null,
        "rationale": null,
        "sizeException": null
      },
      "assumptions": [
        "The final base-to-head artifact delta is valued once with modern 2026-equivalent technology.",
        "Commit count, elapsed time, authorship, messages, and intermediate churn are not effort multipliers."
      ],
      "exclusions": [
        "Historical rework and discarded intermediate states are excluded."
      ],
      "uncertaintyReasons": []
    },
    {
      "id": "target:change-item:change-comprehension:c3bff0f91468e4bcb82f",
      "sourceCapabilityId": "change-item:change-comprehension:c3bff0f91468e4bcb82f",
      "category": "specification-comprehension-and-domain-learning",
      "title": "Understand the bounded change specification",
      "scope": ".",
      "sourceWorkItemIds": [
        "change-item:change-comprehension:c3bff0f91468e4bcb82f"
      ],
      "evidenceIds": [
        "change:path:aaaaec349d37340efffbdf86"
      ],
      "candidate": {
        "hours": null,
        "confidence": null,
        "reason": "Comprehend the final behavior and quality delta represented by the affected capability categories."
      },
      "review": {
        "hours": null,
        "rationale": null,
        "sizeException": null
      },
      "assumptions": [
        "The final base-to-head artifact delta is valued once with modern 2026-equivalent technology.",
        "Commit count, elapsed time, authorship, messages, and intermediate churn are not effort multipliers."
      ],
      "exclusions": [
        "Historical rework and discarded intermediate states are excluded."
      ],
      "uncertaintyReasons": []
    },
    {
      "id": "target:change-item:change-review:f2f9f7f8f9c59b53afeb",
      "sourceCapabilityId": "change-item:change-review:f2f9f7f8f9c59b53afeb",
      "category": "self-review-and-system-integration",
      "title": "Review and integrate the completed change",
      "scope": ".",
      "sourceWorkItemIds": [
        "change-item:change-review:f2f9f7f8f9c59b53afeb"
      ],
      "evidenceIds": [
        "change:path:aaaaec349d37340efffbdf86"
      ],
      "candidate": {
        "hours": null,
        "confidence": null,
        "reason": "Review the coherent final delta and integrate its affected maintained artifacts; this is derived from final scope rather than commit count."
      },
      "review": {
        "hours": null,
        "rationale": null,
        "sizeException": null
      },
      "assumptions": [
        "The final base-to-head artifact delta is valued once with modern 2026-equivalent technology.",
        "Commit count, elapsed time, authorship, messages, and intermediate churn are not effort multipliers."
      ],
      "exclusions": [
        "Historical rework and discarded intermediate states are excluded."
      ],
      "uncertaintyReasons": []
    }
  ],
  "professionalizationGapWorkItemIds": [],
  "instructions": [
    "Confirm repository-family identity, immutable base/head provenance, license, redistribution, and partition before compilation.",
    "Estimate only the normalized final functional and quality delta; intermediate churn, commit count, author, and elapsed time are forbidden signals.",
    "Use the source Change report and explain query to verify evidence, exclusions, and final-delta reconciliation without using candidate hours when blind.",
    "Fill review hours and rationale independently for every represented target; use an exact 0/0/0 range plus a size exception for a reviewed false positive, while an empty target list is valid only for a zero-EHE final delta.",
    "Keep expected targets near 0.5 to 8 hours, record uncertainty explicitly, and reconcile the final total only after target review.",
    "Compile teacher labels before a distinct reviewer receives a blind second-pass packet; packet generation alone does not advance maturity."
  ]
}
